{
  "schema_version": "1.0",
  "detector": {
    "framework": "mmdetection@v3.2.0",
    "config": "mmdetection/configs/rtmdet/rtmdet_m_8xb32-300e_coco.py",
    "config_url": "https://raw.githubusercontent.com/open-mmlab/mmdetection/v3.2.0/configs/rtmdet/rtmdet_m_8xb32-300e_coco.py",
    "config_sha256": "c04a67ac0fbb48df14ada534f16186e1e4eb6cd5bb5ad0c32b1c64835f4e39e4",
    "checkpoint": "player_perception/rtmdet_m_8xb32-300e_coco_20220719_112220-229f527c.pth",
    "checkpoint_url": "https://download.openmmlab.com/mmdetection/v3.0/rtmdet/rtmdet_m_8xb32-300e_coco/rtmdet_m_8xb32-300e_coco_20220719_112220-229f527c.pth",
    "checksum_sha256": "229f527ca88498e8894a778a62a878a322b4a3ea2cae09ea537d34b7e907792b",
    "input_size": [640, 640],
    "confidence_threshold": 0.35,
    "keypoint_convention": "coco-person-category-0",
    "keypoint_count": 1
  },
  "tracker": {
    "implementation": "simple-iou-fallback",
    "future_implementation": "official ByteTrack or validated MMTracking adapter",
    "high_threshold": 0.55,
    "low_threshold": 0.10,
    "match_threshold": 0.80
  },
  "pose": {
    "framework": "mmpose@v1.3.2",
    "config": "mmpose/configs/wholebody_2d_keypoint/rtmpose/coco-wholebody/rtmpose-m_8xb64-270e_coco-wholebody-256x192.py",
    "config_url": "https://raw.githubusercontent.com/open-mmlab/mmpose/v1.3.2/configs/wholebody_2d_keypoint/rtmpose/coco-wholebody/rtmpose-m_8xb64-270e_coco-wholebody-256x192.py",
    "config_sha256": "eb90c8d0816330b27f42740249d5c8210885d4b3086649828529036434377aa7",
    "checkpoint": "player_perception/rtmpose-m_simcc-coco-wholebody_pt-aic-coco_270e-256x192-cd5e845c_20230123.pth",
    "checkpoint_url": "https://download.openmmlab.com/mmpose/v1/projects/rtmposev1/rtmpose-m_simcc-coco-wholebody_pt-aic-coco_270e-256x192-cd5e845c_20230123.pth",
    "checksum_sha256": "3da02694cd6479d3b333ff42ebd0723f96bfa06adac1db1e2e815ed2e9e1b02d",
    "input_size": [192, 256],
    "confidence_threshold": 0.25,
    "keypoint_convention": "coco-wholebody-133-from-dataset-meta",
    "keypoint_count": 133,
    "metainfo_url": "https://raw.githubusercontent.com/open-mmlab/mmpose/v1.3.2/configs/_base_/datasets/coco_wholebody.py",
    "keypoint_names": [
      "nose", "left_eye", "right_eye", "left_ear", "right_ear",
      "left_shoulder", "right_shoulder", "left_elbow", "right_elbow",
      "left_wrist", "right_wrist", "left_hip", "right_hip", "left_knee",
      "right_knee", "left_ankle", "right_ankle", "left_big_toe",
      "left_small_toe", "left_heel", "right_big_toe", "right_small_toe",
      "right_heel", "face-0", "face-1", "face-2", "face-3", "face-4",
      "face-5", "face-6", "face-7", "face-8", "face-9", "face-10",
      "face-11", "face-12", "face-13", "face-14", "face-15", "face-16",
      "face-17", "face-18", "face-19", "face-20", "face-21", "face-22",
      "face-23", "face-24", "face-25", "face-26", "face-27", "face-28",
      "face-29", "face-30", "face-31", "face-32", "face-33", "face-34",
      "face-35", "face-36", "face-37", "face-38", "face-39", "face-40",
      "face-41", "face-42", "face-43", "face-44", "face-45", "face-46",
      "face-47", "face-48", "face-49", "face-50", "face-51", "face-52",
      "face-53", "face-54", "face-55", "face-56", "face-57", "face-58",
      "face-59", "face-60", "face-61", "face-62", "face-63", "face-64",
      "face-65", "face-66", "face-67", "left_hand_root", "left_thumb1",
      "left_thumb2", "left_thumb3", "left_thumb4", "left_forefinger1",
      "left_forefinger2", "left_forefinger3", "left_forefinger4",
      "left_middle_finger1", "left_middle_finger2", "left_middle_finger3",
      "left_middle_finger4", "left_ring_finger1", "left_ring_finger2",
      "left_ring_finger3", "left_ring_finger4", "left_pinky_finger1",
      "left_pinky_finger2", "left_pinky_finger3", "left_pinky_finger4",
      "right_hand_root", "right_thumb1", "right_thumb2", "right_thumb3",
      "right_thumb4", "right_forefinger1", "right_forefinger2",
      "right_forefinger3", "right_forefinger4", "right_middle_finger1",
      "right_middle_finger2", "right_middle_finger3", "right_middle_finger4",
      "right_ring_finger1", "right_ring_finger2", "right_ring_finger3",
      "right_ring_finger4", "right_pinky_finger1", "right_pinky_finger2",
      "right_pinky_finger3", "right_pinky_finger4"
    ]
  },
  "runtime": {
    "device": "auto",
    "precision": "fp32",
    "batch_size": 2,
    "model_cache_path": "player_perception/cache"
  },
  "license": {
    "source": "OpenMMLab model zoo; exact assets must be recorded before execution",
    "license": "Review upstream detector and pose checkpoint licenses before use",
    "notes": "Paths are repository-relative or mounted; no URL or weight is downloaded by application code. Null checksums block model fetch validation until supplied."
  }
}
